Product Name,ProductName_Id
Smart watch ,0
Perfect Fitness Perfect Rip Deck,1
Under Armour Girls' Toddler Spine Surge Runni,2
Nike Men's Dri-FIT Victory Golf Polo,3
Under Armour Men's Compression EV SL Slide,4
Under Armour Women's Micro G Skulpt Running S,5
Nike Men's Free 5.0+ Running Shoe,6
Glove It Women's Mod Oval 3-Zip Carry All Gol,7
Bridgestone e6 Straight Distance NFL San Dieg,8
Columbia Men's PFG Anchor Tough T-Shirt,9
Titleist Pro V1x Golf Balls,10
Bridgestone e6 Straight Distance NFL Tennesse,11
Polar FT4 Heart Rate Monitor,12
ENO Atlas Hammock Straps,13
adidas Men's F10 Messi TRX FG Soccer Cleat,14
Brooks Women's Ghost 6 Running Shoe,15
Nike Men's CJ Elite 2 TD Football Cleat,16
Diamondback Women's Serene Classic Comfort Bi,17
Industrial consumer electronics,18
Web Camera,19
Dell Laptop,20
SOLE E25 Elliptical,21
Elevation Training Mask 2.0,22
adidas Men's Germany Black Crest Away Tee,23
Team Golf Pittsburgh Steelers Putter Grip,24
Glove It Urban Brick Golf Towel,25
Team Golf Texas Longhorns Putter Grip,26
Nike Men's Deutschland Weltmeister Winners Bl,27
Team Golf St. Louis Cardinals Putter Grip,28
Summer dresses,29
Porcelain crafts,30
Men's gala suit,31
Team Golf Tennessee Volunteers Putter Grip,32
Team Golf San Francisco Giants Putter Grip,33
Glove It Imperial Golf Towel,34
Nike Men's Comfort 2 Slide,35
Under Armour Hustle Storm Medium Duffle Bag,36
Under Armour Kids' Mercenary Slide,37
Under Armour Women's Ignite PIP VI Slide,38
Nike Men's Free TR 5.0 TB Training Shoe,39
adidas Youth Germany Black/Red Away Match Soc,40
TYR Boys' Team Digi Jammer,41
Glove It Women's Imperial Golf Glove,42
Titleist Pro V1x High Numbers Golf Balls,43
Bridgestone e6 Straight Distance NFL Carolina,44
Under Armour Women's Ignite Slide,45
Titleist Pro V1x High Numbers Personalized Go,46
GoPro HERO3+ Black Edition Camera,47
Total Gym 1400,48
Children's heaters,49
Team Golf New England Patriots Putter Grip,50
adidas Kids' F5 Messi FG Soccer Cleat,51
Nike Women's Tempo Shorts,52
Glove It Women's Mod Oval Golf Glove,53
Titleist Pro V1 High Numbers Personalized Gol,54
Under Armour Men's Tech II T-Shirt,55
Baby sweater,56
Mio ALPHA Heart Rate Monitor/Sport Watch,57
Field & Stream Sportsman 16 Gun Fire Safe,58
Sports Books ,59
Diamondback Boys' Insight 24 Performance Hybr,60
Polar Loop Activity Tracker,61
Garmin Forerunner 910XT GPS Watch,62
DVDs ,63
CDs of rock,64
Nike Kids' Grade School KD VI Basketball Shoe,65
Nike Women's Free 5.0 TR FIT PRT 4 Training S,66
Hirzl Women's Soffft Flex Golf Glove,67
The North Face Women's Recon Backpack,68
Lawn mower,69
Nike Dri-FIT Crew Sock 6 Pack,70
Nike Women's Legend V-Neck T-Shirt,71
Garmin Approach S4 Golf GPS Watch,72
insta-bed Neverflat Air Mattress,73
Nike Men's Kobe IX Elite Low Basketball Shoe,74
Adult dog supplies,75
First aid kit,76
Garmin Approach S3 Golf GPS Watch,77
Rock music,78
Fighting video games,79
Fitbit The One Wireless Activity & Sleep Trac,80
Stiga Master Series ST3100 Competition Indoor,81
Diamondback Girls' Clarity 24 Hybrid Bike 201,82
adidas Brazuca 2014 Official Match Ball,83
GolfBuddy VT3 GPS Watch,84
Bushnell Pro X7 Jolt Slope Rangefinder,85
Yakima DoubleDown Ace Hitch Mount 4-Bike Rack,86
Nike Men's Fingertrap Max Training Shoe,87
Bowflex SelectTech 1090 Dumbbells,88
SOLE E35 Elliptical,89
Hirzl Women's Hybrid Golf Glove,90
Hirzl Men's Hybrid Golf Glove,91
TaylorMade 2014 Purelite Stand Bag,92
Bag Boy Beverage Holder,93
Bag Boy M330 Push Cart,94
Clicgear 8.0 Shoe Brush,95
Titleist Small Wheeled Travel Cover,96
Clicgear Rovic Cooler Bag,97
Titleist Club Glove Travel Cover,98
Ogio Race Golf Shoes,99
LIJA Women's Argyle Golf Polo,100
LIJA Women's Eyelet Sleeveless Golf Polo,101
LIJA Women's Button Golf Dress,102
LIJA Women's Mid-Length Panel Golf Shorts,103
TaylorMade Women's RBZ SL Rescue,104
Cleveland Golf Women's 588 RTX CB Satin Chrom,105
Top Flite Women's 2014 XL Hybrid,106
MDGolf Pittsburgh Penguins Putter,107
TaylorMade White Smoke IN-12 Putter,108
Cleveland Golf Collegiate My Custom Wedge 588,109
Merrell Men's All Out Flash Trail Running Sho,110
Merrell Women's Grassbow Sport Waterproof Hik,111
Merrell Women's Siren Mid Waterproof Hiking B,112
Merrell Women's Grassbow Sport Hiking Shoe,113
Toys ,114
Pelican Sunstream 100 Kayak,115
Pelican Maverick 100X Kayak,116
O'Brien Men's Neoprene Life Vest,117
